{
  "captf_contract": "v1alpha1",
  "captf_cluster": {
    "name": "prod",
    "namespace": "team-a"
  },
  "captf_object": {
    "kind": "TerraformCluster",
    "name": "prod-md-0-abcde",
    "namespace": "team-a"
  },
  "captf_tags": {
    "captf.io/cluster": "prod",
    "captf.io/kind": "TerraformCluster",
    "captf.io/managed-by": "captf",
    "captf.io/name": "prod-md-0-abcde",
    "captf.io/namespace": "team-a",
    "captf.io/template": "prod-md-0"
  },
  "control_plane_endpoint": {
    "host": "api.prod.example.com",
    "port": 6443
  },
  "kubernetes_version": "v1.36.2",
  "control_plane_initialized": true,
  "cluster_network": {
    "pods": [
      "192.168.0.0/16"
    ],
    "services": [
      "10.96.0.0/12"
    ],
    "service_domain": "cluster.local",
    "api_server_port": 6443
  }
}
